{
  "schema": "https://raw.githubusercontent.com/anomalyco/tools/main/docstructure/output/schema/v1.json",
  "document": {
    "id": "dedf97e6-1fab-436d-b17a-80231b8b7fa8",
    "source": "/home/kunta/projects/tools/.samples/stress/business_report.docx",
    "parser": "docx",
    "parser_version": "1.0",
    "created_at": "2026-07-03T21:14:41.387493+00:00",
    "metadata": {
      "source": "/home/kunta/projects/tools/.samples/stress/business_report.docx",
      "file_format": "docx",
      "page_count": null,
      "char_count": 1155
    }
  },
  "nodes": [
    {
      "id": 1,
      "kind": "paragraph",
      "provenance": {
        "confidence": 0.4,
        "produced_by": "paragraph_classifier/v1",
        "version": "1.0",
        "evidence": [
          "score_heading=8"
        ]
      },
      "order": 0,
      "features": {
        "word_count": 5,
        "sentence_count": 1,
        "font_size": 16.0,
        "font_name": "",
        "bold": true,
        "italic": false,
        "centered": true,
        "monospace": false,
        "alignment": "center",
        "first_line_indent": 0.0,
        "space_before": null,
        "space_after": null
      },
      "text": "Q4 2025 Financial Performance Report",
      "runs": [
        {
          "id": 0,
          "type": "text",
          "text": "Q4 2025 Financial Performance Report",
          "bold": true,
          "italic": false,
          "font_size": 16.0,
          "font_name": "",
          "is_hidden": false
        }
      ],
      "role": "heading",
      "heading_level": 1,
      "style_name": "Normal",
      "style_base": "Normal",
      "style_hierarchy": [
        "Normal"
      ],
      "is_visual_blank": false,
      "is_hidden": false,
      "is_list_item": false,
      "in_table": false,
      "page_break_before": false,
      "page_break_after": false
    },
    {
      "id": 62,
      "kind": "table",
      "provenance": {
        "confidence": 0.0,
        "produced_by": "",
        "version": "1.0",
        "evidence": []
      },
      "order": 0,
      "rows": [
        {
          "cells": [
            {
              "child_ids": [
                15
              ],
              "container_id": 62
            },
            {
              "child_ids": [
                17
              ],
              "container_id": 62
            },
            {
              "child_ids": [
                19
              ],
              "container_id": 62
            },
            {
              "child_ids": [
                21
              ],
              "container_id": 62
            }
          ]
        },
        {
          "cells": [
            {
              "child_ids": [
                23
              ],
              "container_id": 62
            },
            {
              "child_ids": [
                25
              ],
              "container_id": 62
            },
            {
              "child_ids": [
                27
              ],
              "container_id": 62
            },
            {
              "child_ids": [
                29
              ],
              "container_id": 62
            }
          ]
        },
        {
          "cells": [
            {
              "child_ids": [
                31
              ],
              "container_id": 62
            },
            {
              "child_ids": [
                33
              ],
              "container_id": 62
            },
            {
              "child_ids": [
                35
              ],
              "container_id": 62
            },
            {
              "child_ids": [
                37
              ],
              "container_id": 62
            }
          ]
        },
        {
          "cells": [
            {
              "child_ids": [
                39
              ],
              "container_id": 62
            },
            {
              "child_ids": [
                41
              ],
              "container_id": 62
            },
            {
              "child_ids": [
                43
              ],
              "container_id": 62
            },
            {
              "child_ids": [
                45
              ],
              "container_id": 62
            }
          ]
        },
        {
          "cells": [
            {
              "child_ids": [
                47
              ],
              "container_id": 62
            },
            {
              "child_ids": [
                49
              ],
              "container_id": 62
            },
            {
              "child_ids": [
                51
              ],
              "container_id": 62
            },
            {
              "child_ids": [
                53
              ],
              "container_id": 62
            }
          ]
        },
        {
          "cells": [
            {
              "child_ids": [
                55
              ],
              "container_id": 62
            },
            {
              "child_ids": [
                57
              ],
              "container_id": 62
            },
            {
              "child_ids": [
                59
              ],
              "container_id": 62
            },
            {
              "child_ids": [
                61
              ],
              "container_id": 62
            }
          ]
        }
      ]
    },
    {
      "id": 2,
      "kind": "paragraph",
      "provenance": {
        "confidence": 0.3333333333333333,
        "produced_by": "paragraph_classifier/v1",
        "version": "1.0",
        "evidence": [
          "score_caption=4"
        ]
      },
      "order": 1,
      "features": {
        "word_count": 4,
        "sentence_count": 1,
        "font_size": null,
        "font_name": "",
        "bold": false,
        "italic": false,
        "centered": true,
        "monospace": false,
        "alignment": "center",
        "first_line_indent": 0.0,
        "space_before": null,
        "space_after": null
      },
      "text": "Prepared by: Finance Department",
      "runs": [
        {
          "id": 0,
          "type": "text",
          "text": "Prepared by: Finance Department",
          "bold": false,
          "italic": false,
          "font_size": null,
          "font_name": "",
          "is_hidden": false
        }
      ],
      "role": "caption",
      "style_name": "Normal",
      "style_base": "Normal",
      "style_hierarchy": [
        "Normal"
      ],
      "is_visual_blank": false,
      "is_hidden": false,
      "is_list_item": false,
      "in_table": false,
      "page_break_before": false,
      "page_break_after": false
    },
    {
      "id": 3,
      "kind": "paragraph",
      "provenance": {
        "confidence": 0.5,
        "produced_by": "paragraph_classifier/v1",
        "version": "1.0",
        "evidence": [
          "score_title=6"
        ]
      },
      "order": 2,
      "features": {
        "word_count": 3,
        "sentence_count": 1,
        "font_size": null,
        "font_name": "",
        "bold": false,
        "italic": false,
        "centered": true,
        "monospace": false,
        "alignment": "center",
        "first_line_indent": 0.0,
        "space_before": null,
        "space_after": null
      },
      "text": "January 15, 2026",
      "runs": [
        {
          "id": 0,
          "type": "text",
          "text": "January 15, 2026",
          "bold": false,
          "italic": false,
          "font_size": null,
          "font_name": "",
          "is_hidden": false
        }
      ],
      "role": "title",
      "style_name": "Normal",
      "style_base": "Normal",
      "style_hierarchy": [
        "Normal"
      ],
      "is_visual_blank": false,
      "is_hidden": false,
      "is_list_item": false,
      "in_table": false,
      "page_break_before": false,
      "page_break_after": false
    },
    {
      "id": 4,
      "kind": "paragraph",
      "provenance": {
        "confidence": 0.0,
        "produced_by": "paragraph_classifier/v1",
        "version": "1.0",
        "evidence": [
          "blank_paragraph"
        ]
      },
      "order": 3,
      "features": {
        "word_count": 0,
        "sentence_count": 0,
        "font_size": null,
        "font_name": "",
        "bold": false,
        "italic": false,
        "centered": false,
        "monospace": false,
        "alignment": "left",
        "first_line_indent": 0.0,
        "space_before": null,
        "space_after": null
      },
      "text": "",
      "runs": [
        {
          "id": 0,
          "type": "text",
          "text": "",
          "bold": false,
          "italic": false,
          "font_size": null,
          "font_name": "",
          "is_hidden": false
        }
      ],
      "role": "body",
      "style_name": "Normal",
      "style_base": "Normal",
      "style_hierarchy": [
        "Normal"
      ],
      "is_visual_blank": true,
      "is_hidden": false,
      "is_list_item": false,
      "in_table": false,
      "page_break_before": true,
      "page_break_after": false
    },
    {
      "id": 5,
      "kind": "paragraph",
      "provenance": {
        "confidence": 0.4090909090909091,
        "produced_by": "paragraph_classifier/v1",
        "version": "1.0",
        "evidence": [
          "score_heading=9"
        ]
      },
      "order": 4,
      "features": {
        "word_count": 2,
        "sentence_count": 1,
        "font_size": 14.0,
        "font_name": "",
        "bold": true,
        "italic": false,
        "centered": false,
        "monospace": false,
        "alignment": "left",
        "first_line_indent": 0.0,
        "space_before": null,
        "space_after": null
      },
      "text": "Executive Summary",
      "runs": [
        {
          "id": 0,
          "type": "text",
          "text": "Executive Summary",
          "bold": true,